{
  "profile": "ReturnModuleAuthoringDraft/1",
  "name": "P retained return module",
  "source": {
    "packet_sha256": "690265c8b88b620ebb5de0e9aa3544428f6895e41343b6098f13ae1a72b76612",
    "opening_sha256": "fcdd3f55e7ea658a0d28eeed17d9490fcde073ba24da0cdab40e2c68f2af6237",
    "meaning": "retained_synthetic_case"
  },
  "context": {
    "entity": "P",
    "book_role": "legal",
    "currency": "USD",
    "case_id": "retained_company_composition"
  },
  "period": {
    "start": "2025-01-01",
    "end_exclusive": "2026-01-01"
  },
  "accounts": {
    "cash": "cash",
    "inventory": "inventory",
    "refund_liability": "refund_liability",
    "recovery_asset": "recovery_asset",
    "revenue": "revenue",
    "cogs": "cogs",
    "selling_expense": "selling_expense",
    "dta": "dta",
    "dtl": "dtl",
    "current_tax": "current_tax",
    "deferred_tax": "deferred_tax"
  },
  "component": {
    "id": "return_component",
    "source_pointer": "/record_registry/fcdd3f55e7ea658a0d28eeed17d9490fcde073ba24da0cdab40e2c68f2af6237/body/returns",
    "sold_units": "10/1",
    "expected_units": "2/1",
    "unit_refund": "20/1",
    "unit_cost": "12/1",
    "estimated_handling": "3/1",
    "estimated_deterioration": "1/1",
    "refund": "40/1",
    "recovery": "16/1",
    "settled": false
  },
  "tax": {
    "method": "refund_and_recovered_stock_on_settlement",
    "rate": "1/4",
    "source_pointer": "/record_registry/8218b118eb8a0d327fbd15b2b6f0152967bad2ac158d1dbd9f82f5efb6c07c13/body/parameters",
    "opening_source_pointer": "/record_registry/fcdd3f55e7ea658a0d28eeed17d9490fcde073ba24da0cdab40e2c68f2af6237/body/books/P",
    "refund_tax_base": "0/1",
    "recovery_tax_base": "0/1",
    "opening_dta": "10/1",
    "opening_dtl": "4/1",
    "rate_enacted": true,
    "recovery_supported": true,
    "temporary_difference_inventory_complete": true,
    "outside_basis_timing_control": true,
    "outside_basis_no_foreseeable_reversal": true
  },
  "lots": [],
  "events": [
    {
      "id": "return_settlement",
      "kind": "settle",
      "method": "returns.settle",
      "date": "2025-02-01",
      "source_pointer": "/record_registry/72a228551e88fbc24e302f5c058ee85fd9d12ca969e5b795db7a9748e7b855b1/body",
      "component_id": "return_component",
      "lot_id": "recovered",
      "actual_units": "2/1",
      "unit_handling": "4/1",
      "unit_deterioration": "2/1",
      "refund_cash": "40/1",
      "handling_cash": "8/1",
      "inventory_nrv": "20/1",
      "all_rights_closed": true,
      "handling_is_selling_cost": true
    },
    {
      "id": "recovered_sale",
      "kind": "sell",
      "method": "inventory.sell",
      "date": "2025-09-01",
      "source_pointer": "/record_registry/25c26f8e6a2366d409584f3de279fcaa9fa3144e3814b466f89ed0210a88be64/body",
      "lot_id": "recovered",
      "fraction": "1/1",
      "proceeds": "40/1",
      "performance_complete": true
    }
  ]
}
